{
  "objective": "Seed baseline for synthetic_fraud: pr_auc on the held-out test split.",
  "modeling_plan": {
    "candidate_models": [
      {
        "name": "logistic_regression",
        "library": "scikit-learn",
        "rationale": "Simple, interpretable reference.",
        "search_space": {
          "C": [
            0.1,
            1.0
          ]
        }
      },
      {
        "name": "lightgbm",
        "library": "lightgbm",
        "rationale": "Gradient-boosting contender.",
        "search_space": {
          "n_estimators": 200,
          "learning_rate": 0.05,
          "num_leaves": 15,
          "min_child_samples": 50
        }
      }
    ],
    "validation_strategy": "5-fold expanding-window TimeSeriesSplit",
    "primary_metric": "pr_auc",
    "selection_criteria": "Permutation feature selection, then paired per-fold family comparison."
  },
  "preprocessing_plan": {
    "engine": "open_source",
    "drop_columns": [
      "transaction_id",
      "customer_id",
      "event_time",
      "currency",
      "merchant_id",
      "chargeback_flag"
    ],
    "imputation": "Median + missing indicators, fit on train",
    "categorical_encoding": "One-hot, unknown ignored"
  },
  "steps": [
    "data-preprocessing",
    "training",
    "evaluation"
  ],
  "risks": [
    "Smoke-sized data: wide CV error bars."
  ],
  "notes": "Generated by scripts/generate_dataset_seeds.py."
}
